{
 "units": "meters",
 "beds": [
  {
   "id": "bed_upper_bank",
   "polygon": [
    [
     10.9,
     3.8
    ],
    [
     11.05,
     2
    ],
    [
     11.5,
     0.2
    ],
    [
     11.6,
     -1.9
    ],
    [
     11.3,
     -3.9
    ],
    [
     10.85,
     -5.9
    ],
    [
     10.6,
     -7.9
    ],
    [
     10.8,
     -9.5
    ],
    [
     9.7,
     -9.3
    ],
    [
     9.5,
     -7
    ],
    [
     9.6,
     -4.2
    ],
    [
     9.8,
     -1.4
    ],
    [
     9.7,
     1.4
    ],
    [
     9.8,
     3.6
    ]
   ],
   "mulch": "3/4 inch crushed granite"
  },
  {
   "id": "bed_door_bank",
   "polygon": [
    [
     12.7,
     7.6
    ],
    [
     13.8,
     8.3
    ],
    [
     15.1,
     8
    ],
    [
     16.3,
     7
    ],
    [
     16.7,
     5.4
    ],
    [
     16.2,
     4
    ],
    [
     15.2,
     3.4
    ],
    [
     14.6,
     4.3
    ],
    [
     13.7,
     5.2
    ],
    [
     13,
     6
    ],
    [
     12.6,
     6.9
    ]
   ],
   "mulch": "3/4 inch crushed granite"
  },
  {
   "id": "bed_terrace_apron",
   "polygon": [
    [
     14.1,
     -3.4
    ],
    [
     13.3,
     -4.4
    ],
    [
     13,
     -6.1
    ],
    [
     13.2,
     -7.8
    ],
    [
     13.7,
     -9.2
    ],
    [
     14.6,
     -10.2
    ],
    [
     15.9,
     -10.8
    ],
    [
     17,
     -10.4
    ],
    [
     17.3,
     -9.3
    ],
    [
     16.4,
     -9.8
    ],
    [
     15.2,
     -9.9
    ],
    [
     14.5,
     -9.2
    ],
    [
     14.05,
     -7.4
    ],
    [
     13.95,
     -5.2
    ]
   ],
   "mulch": "3/4 inch crushed granite"
  },
  {
   "id": "bed_north_slope",
   "polygon": [
    [
     10.3,
     8.8
    ],
    [
     11.4,
     9.4
    ],
    [
     12.6,
     9
    ],
    [
     13.8,
     9.5
    ],
    [
     14.9,
     10.6
    ],
    [
     15,
     12.2
    ],
    [
     14,
     13.6
    ],
    [
     12.5,
     14.4
    ],
    [
     11,
     14.2
    ],
    [
     10.2,
     13
    ],
    [
     10.1,
     11.3
    ],
    [
     10.2,
     10
    ]
   ],
   "mulch": "3/4 inch crushed granite"
  },
  {
   "id": "bed_south",
   "polygon": [
    [
     13,
     -10.9
    ],
    [
     14.3,
     -11.2
    ],
    [
     15.4,
     -12
    ],
    [
     15.9,
     -13.4
    ],
    [
     15,
     -14.6
    ],
    [
     13.2,
     -14.9
    ],
    [
     11.3,
     -14.6
    ],
    [
     10.3,
     -13.6
    ],
    [
     10.55,
     -12.5
    ],
    [
     11.6,
     -12.9
    ],
    [
     12.5,
     -12.5
    ],
    [
     13.15,
     -11.8
    ]
   ],
   "mulch": "3/4 inch crushed granite"
  },
  {
   "id": "bed_bank_shelf",
   "polygon": [
    [
     9.95,
     -1.75
    ],
    [
     10.12,
     -2.3
    ],
    [
     10.47,
     -3.05
    ],
    [
     10.87,
     -3.8
    ],
    [
     11.22,
     -4.58
    ],
    [
     11.3,
     -5.12
    ],
    [
     11.24,
     -5.58
    ],
    [
     10.6,
     -5.66
    ],
    [
     10.35,
     -5
    ],
    [
     10.18,
     -4.35
    ],
    [
     9.98,
     -3.6
    ],
    [
     9.78,
     -2.85
    ],
    [
     9.72,
     -2.2
    ]
   ],
   "mulch": "3/4 inch crushed granite",
   "level_m": -0.85
  },
  {
   "id": "bed_shoulder",
   "polygon": [
    [
     13,
     3.3
    ],
    [
     14,
     1.8
    ],
    [
     13.9,
     0.4
    ],
    [
     13.7,
     -0.9
    ],
    [
     13.9,
     -2.1
    ],
    [
     13.48,
     -2.72
    ],
    [
     13.6,
     -1.6
    ],
    [
     13.3,
     -0.2
    ],
    [
     13.05,
     1.2
    ],
    [
     12.95,
     2.4
    ]
   ],
   "mulch": "3/4 inch crushed granite"
  }
 ],
 "paths": [
  {
   "id": "contour_walk",
   "spline": [
    [
     11.4,
     4.5
    ],
    [
     11.7,
     2.4
    ],
    [
     12.4,
     0.4
    ],
    [
     12.9,
     -1.8
    ],
    [
     12.5,
     -4
    ],
    [
     11.9,
     -6.3
    ],
    [
     11.6,
     -8.5
    ],
    [
     11.8,
     -11.2
    ]
   ],
   "width_m": 1.05,
   "material": "decomposed_granite"
  },
  {
   "id": "return_stones",
   "spline": [
    [
     15.8,
     -3.5
    ],
    [
     16,
     -2.2
    ],
    [
     15.7,
     -1.4
    ]
   ],
   "width_m": 0.75,
   "material": "stepping_stones"
  },
  {
   "id": "court_link",
   "spline": [
    [
     14.4,
     2.4
    ],
    [
     13.8,
     3.2
    ],
    [
     13.4,
     4
    ],
    [
     12.6,
     5
    ]
   ],
   "width_m": 0.8,
   "material": "stepping_stones"
  }
 ],
 "edges": [
  {
   "id": "court_brow_wall",
   "spline": [
    [
     12.1,
     4.9
    ],
    [
     12.6,
     6.1
    ],
    [
     12.3,
     7.5
    ],
    [
     11.5,
     8.9
    ],
    [
     11.1,
     10.2
    ]
   ],
   "height_m": 0.5,
   "material": "dry_stone",
   "retains": "downhill",
   "level_m": -1.88
  },
  {
   "id": "lookout_wall",
   "spline": [
    [
     12.85,
     -11.5
    ],
    [
     12.9,
     -12.4
    ],
    [
     12.2,
     -13.05
    ],
    [
     11.2,
     -13.05
    ]
   ],
   "height_m": 0.35,
   "material": "dry_stone",
   "retains": "downhill",
   "level_m": -0.64
  },
  {
   "id": "terrace_brow_wall",
   "spline": [
    [
     16.2,
     -9.5
    ],
    [
     17.3,
     -8.5
    ],
    [
     17.4,
     -6.6
    ],
    [
     17,
     -4.8
    ],
    [
     16.2,
     -3.6
    ]
   ],
   "height_m": 0.35,
   "material": "dry_stone",
   "retains": "downhill",
   "level_m": -1.95
  },
  {
   "id": "court_cut_stones",
   "spline": [
    [
     9.48,
     6.85
    ],
    [
     9.6,
     7.6
    ],
    [
     9.5,
     9.3
    ]
   ],
   "height_m": 0.4,
   "material": "boulder",
   "retains": "uphill"
  },
  {
   "id": "bank_steel",
   "spline": [
    [
     9.92,
     -1.55
    ],
    [
     10.1,
     -2.25
    ],
    [
     10.45,
     -3
    ],
    [
     10.85,
     -3.75
    ],
    [
     11.2,
     -4.55
    ],
    [
     11.28,
     -5.1
    ],
    [
     11.22,
     -5.55
    ]
   ],
   "height_m": 0.2,
   "material": "corten_steel",
   "retains": "uphill"
  },
  {
   "id": "tea_court_bank",
   "spline": [
    [
     14.3,
     -1.1
    ],
    [
     14.2,
     1
    ],
    [
     15.0,
     2.0
    ],
    [
     15.45,
     2.55
    ],
    [
     15.65,
     3.05
    ]
   ],
   "height_m": 0.35,
   "material": "dry_stone",
   "retains": "uphill",
   "level_m": -2.35
  }
 ],
 "patios": [
  {
   "id": "entry_court",
   "polygon": [
    [
     9.5,
     4.4
    ],
    [
     11,
     4.35
    ],
    [
     12.1,
     4.9
    ],
    [
     12.6,
     6.1
    ],
    [
     12.3,
     7.5
    ],
    [
     11.5,
     8.9
    ],
    [
     11.1,
     10.2
    ],
    [
     10.1,
     10.5
    ],
    [
     9.5,
     9.3
    ],
    [
     9.65,
     7.5
    ],
    [
     9.4,
     6
    ]
   ],
   "material": "natural stone sett nobedan",
   "purpose": "standing room at the back door and in front of the planter bed",
   "level_m": -1.88
  },
  {
   "id": "south_lookout",
   "polygon": [
    [
     10.9,
     -10.9
    ],
    [
     12,
     -10.9
    ],
    [
     12.8,
     -11.5
    ],
    [
     12.9,
     -12.4
    ],
    [
     12.2,
     -13
    ],
    [
     11.2,
     -13
    ],
    [
     10.6,
     -12.4
    ],
    [
     10.6,
     -11.5
    ]
   ],
   "material": "decomposed_granite",
   "purpose": "sitting and looking back over the garden",
   "level_m": -0.64
  },
  {
   "id": "lower_terrace",
   "polygon": [
    [
     14.7,
     -9.4
    ],
    [
     16.2,
     -9.5
    ],
    [
     17.3,
     -8.5
    ],
    [
     17.4,
     -6.6
    ],
    [
     17,
     -4.8
    ],
    [
     16.2,
     -3.6
    ],
    [
     15,
     -3.5
    ],
    [
     14.4,
     -4.8
    ],
    [
     14.3,
     -6.6
    ],
    [
     14.4,
     -8.2
    ]
   ],
   "material": "flagstone",
   "purpose": "dining, sitting and the fire bowl",
   "level_m": -1.95
  },
  {
   "id": "tea_court",
   "polygon": [
    [
     14.3,
     -1.1
    ],
    [
     15.4,
     -1.3
    ],
    [
     16.3,
     -0.4
    ],
    [
     16.5,
     1
    ],
    [
     16.1,
     2.2
    ],
    [
     15.2,
     2.6
    ],
    [
     14.4,
     2.3
    ],
    [
     14.1,
     1
    ]
   ],
   "material": "gravel",
   "purpose": "a tea court \u2014 one bench, the lantern, the long view back uphill",
   "level_m": -2.35
  }
 ],
 "plants": [
  {
   "species": "Ceanothus spp.",
   "common": "California lilac",
   "form": "mound",
   "foliage": "dark_green",
   "mature_height_m": 3,
   "mature_spread_m": 3.5,
   "position": [
    15.94,
    6.39
   ],
   "id": "p1"
  },
  {
   "species": "Arctostaphylos spp.",
   "common": "Manzanita",
   "form": "mound",
   "foliage": "grey_green",
   "mature_height_m": 2.5,
   "mature_spread_m": 2.5,
   "position": [
    12.69,
    7.41
   ],
   "id": "p2"
  },
  {
   "species": "Arctostaphylos spp.",
   "common": "Manzanita",
   "form": "mound",
   "foliage": "grey_green",
   "mature_height_m": 2.5,
   "mature_spread_m": 2.5,
   "position": [
    13.46,
    5.57
   ],
   "id": "p3"
  },
  {
   "species": "Festuca californica",
   "common": "California fescue",
   "form": "grass",
   "foliage": "blue_green",
   "mature_height_m": 0.75,
   "mature_spread_m": 0.9,
   "position": [
    14.61,
    8.04
   ],
   "id": "p4"
  },
  {
   "species": "Festuca californica",
   "common": "California fescue",
   "form": "grass",
   "foliage": "blue_green",
   "mature_height_m": 0.75,
   "mature_spread_m": 0.9,
   "position": [
    13.89,
    8.19
   ],
   "id": "p5"
  },
  {
   "species": "Festuca californica",
   "common": "California fescue",
   "form": "grass",
   "foliage": "blue_green",
   "mature_height_m": 0.75,
   "mature_spread_m": 0.9,
   "position": [
    14.35,
    7.35
   ],
   "id": "p6"
  },
  {
   "species": "Festuca californica",
   "common": "California fescue",
   "form": "grass",
   "foliage": "blue_green",
   "mature_height_m": 0.75,
   "mature_spread_m": 0.9,
   "position": [
    14.75,
    4.99
   ],
   "id": "p7"
  },
  {
   "species": "Festuca californica",